{
  "taskId": "bridge-b-autonomous-backlog",
  "title": "Implement AI-DEV-BRIDGE-B autonomous backlog runner",
  "objective": "Upgrade the existing Codex × Antigravity bridge from one-task orchestration to a fail-closed serial DAG backlog runner. Antigravity is planner/auditor only and must never edit implementation files while Codex owns a task worktree. Codex is the only implementation writer. Add exclusive worktree/path leases, dependency resolution with cycle detection, runtime task state, automatic R0-R2 execution, max 3 correction cycles using existing runner, guarded feature-branch push, optional PR creation when authenticated GitHub CLI is available, and hard human gates for R3/R4 or main merge. Default maxConcurrency must be 1 to eliminate collisions. Runtime state and leases must stay under .artifacts and never be committed. The runner must read config/autonomy/system-roadmap.json and execute only tasks whose dependencies are completed. It must stop or block downstream tasks at HUMAN_GATE without skipping phase dependencies. Also reconcile PROJECT_STATE.md so CURRENT_PHASE reflects AI-DEV-BRIDGE-B bootstrap, 06K-B/06K-B.1 are completed/merged, NEXT_PHASE is 06K-C readiness then gated production apply, and stale 06K-A/06K-B pending entries are removed.",
  "repository": {
    "root": ".",
    "baseRef": "origin/feature/ai-dev-bridge-b-autonomous-backlog",
    "taskBranch": "agent-task/bridge-b-autonomous-backlog"
  },
  "scope": {
    "allowedPaths": [
      "automation/agent-bridge/",
      "config/autonomy/",
      "schemas/",
      "tests/automation/",
      "docs/automation/",
      "package.json",
      "PROJECT_STATE.md"
    ],
    "forbiddenPaths": [
      "supabase/migrations/",
      "supabase/rollback/",
      ".env",
      ".artifacts/",
      "secrets/",
      "apps/control-center/",
      "apps/dispatcher/"
    ]
  },
  "risk": {
    "level": "R2",
    "reason": "Feature-branch automation code, tests, local worktrees, commits and feature push only; no production mutation or main merge."
  },
  "execution": {
    "maxCycles": 3,
    "timeoutSeconds": 3600
  },
  "verification": {
    "commands": [
      "npm run typecheck",
      "npm run test:bridge"
    ]
  },
  "sourceControl": {
    "commitAllowed": true,
    "pushFeatureBranchAllowed": true,
    "prCreationAllowed": true,
    "mergeAllowed": false
  },
  "createdAt": "2026-09-23T15:20:00+07:00"
}
